{
  "schema_version": "1.0",
  "project_id": "018f6b2e-a3d1-7c01-9e2a-5f8d3a1b7c02",
  "name": "Superconducting Qubits",
  "description": "Long-running reading project on superconducting qubit platforms.",
  "vault_path": "vault/superconducting-qubits",
  "archived": false,
  "created_at": "2026-01-15T08:30:00Z",
  "updated_at": "2026-02-02T10:12:00Z"
}
